author,url_identifier,type,subject,campus,date_issued,language,title,department,peerreviewed
"Bronkema-Bekker, Benjamin",https://hdl.handle.net/2027.42/169434,Thesis,,Ann Arbor,2021-04,,Displaced Pensioners and Peace in the Donbass Conflict,Honors Theses (Bachelor's),
"Cassador, Niquelle",https://hdl.handle.net/2027.42/169436,Thesis,,Ann Arbor,2021-04,,The Connections We Make: Friendship as the Path from Moral Disorientation,Honors Theses (Bachelor's),
"Sherk, Josiah",https://hdl.handle.net/2027.42/169417,Thesis,,Ann Arbor,2021-04,,In-Situ Candidates in the Stellar Halo of NGC 253,Honors Theses (Bachelor's),
"Jindal-Talib, Anju",https://hdl.handle.net/2027.42/169393,Thesis,,Ann Arbor,2021-04,,Identity Development of Mixed Students and The Role of Cultural and Ethnic Student Organizations in Higher Education,Honors Theses (Bachelor's),
"Marcotte, Noah",https://hdl.handle.net/2027.42/169402,Thesis,,Ann Arbor,2021-04,,Exploring Religiosity’s Impact on Two Science-based Issues: Climate Change and Vaccines,Honors Theses (Bachelor's),
"Mueller, Madison",https://hdl.handle.net/2027.42/169406,Thesis,,Ann Arbor,2021-04,,"Post Social Media Use Guilt, Predispositions, and Motivations: A Correlational Study",Honors Theses (Bachelor's),
"Reist, Lucas",https://hdl.handle.net/2027.42/169411,Thesis,,Ann Arbor,2021-04,,A Dissection of Lysosomal Membrane Protein Regulation in Saccharomyces cerevisiae,Honors Theses (Bachelor's),
"Chandler, James",https://hdl.handle.net/2027.42/169377,Thesis,,Ann Arbor,2021-04,,The Effect of the TCJA on Donations to Medical Charities,Honors Theses (Bachelor's),
"Yang, Xilin",https://hdl.handle.net/2027.42/169428,Thesis,,Ann Arbor,2021-04,,Justice in a Pandemic: An Overview of Revised Primary Goods and Policy Tradeoffs,Honors Theses (Bachelor's),
"Ho, Jennifer",https://hdl.handle.net/2027.42/169388,Thesis,,Ann Arbor,2021-04,,Cross-cultural Differences in Perceived Responses to Capitalization Attempts and Relationship Satisfaction,Honors Theses (Bachelor's),
"Jex, Sara",https://hdl.handle.net/2027.42/169391,Thesis,,Ann Arbor,2021-04,,"Going the Social Distance: The COVID-19 Pandemic, Space, and Student Social Connection",Honors Theses (Bachelor's),
"Ho, Deborah",https://hdl.handle.net/2027.42/169389,Thesis,,Ann Arbor,2021-04,,Developing a Data Analysis Pipeline for Novel Bio-Logging Tools,Honors Theses (Bachelor's),
"Lutrzykowska, Zuzanna",https://hdl.handle.net/2027.42/169401,Thesis,,Ann Arbor,2021-04,,The Role of Biomedical Enhancements in the Kantian Duty to Self-Perfect,Honors Theses (Bachelor's),
"Sheridan, Jakob",https://hdl.handle.net/2027.42/169416,Thesis,,Ann Arbor,2021-04,,Physical Origin of Hyperuniformity in Epithelial Tissue,Honors Theses (Bachelor's),
"Mozina, Madeleine",https://hdl.handle.net/2027.42/169405,Thesis,,Ann Arbor,2021-04,,How Social Enterprises Coordinate Cross-Sectoral Solutions for Informal Settlements: A Case Study of Terra Nova in Brazil,Honors Theses (Bachelor's),
"Lee, Verity",https://hdl.handle.net/2027.42/169397,Thesis,,Ann Arbor,2021-04,,Behavioral Models of Neural Pleasure Circuitry: Effects of Sex Differences,Honors Theses (Bachelor's),
"Topor, Madeline",https://hdl.handle.net/2027.42/169419,Thesis,,Ann Arbor,2021-04,,Phosphate Analysis and Evidence for Industry at Iklaina: Implications for Mycenaean Economies and State Formation,Honors Theses (Bachelor's),
"Wolens, Raquel",https://hdl.handle.net/2027.42/169426,Thesis,,Ann Arbor,2021-04,,Schools Conquering the Challenges of Parental Incarceration on America's Youth,Honors Theses (Bachelor's),
"Blumin, Daphne",https://hdl.handle.net/2027.42/169409,Thesis,,Ann Arbor,2021-04,,Phase II-Upgrade for ATLAS: Small-diameter Muon Drift Tubes,Honors Theses (Bachelor's),
"Cho, Sungmin",https://hdl.handle.net/2027.42/169378,Thesis,,Ann Arbor,2021-04,,Youth Involvement and Voting Age: Evidence from South Korea,Honors Theses (Bachelor's),
"Bondoni, Kailyn",https://hdl.handle.net/2027.42/169420,Thesis,,Ann Arbor,2021-04,,The Inevitable Inevitable,Honors Theses (Bachelor's),
"Kish, Ryan",https://hdl.handle.net/2027.42/169234,Project,Business and Economics,Ann Arbor,2021-04,,The Capital Allocation and Agency Problems with Index Funds,"Business, Stephen M. Ross School of - Independent Study Projects",
"Christianson, Paul",https://hdl.handle.net/2027.42/167345,Project,,,2021-04,en_US,Evaluation and Adaptive Management of the Huron River Watershed Council Natural Areas Assessment and Protection Project,Dissertations and Theses (Ph.D. and Master's),
"Gao, Yanning",https://hdl.handle.net/2027.42/167304,Practicum,,,2021-04,en_US,Developing the Kiwanis Environmental Education Preserve,Dissertations and Theses (Ph.D. and Master's),
"Shiffler, Katharine",https://hdl.handle.net/2027.42/167371,Practicum,,,2021-04,en_US,"Therapeutic Design for Healthcare Environments: A Practical Application at St. Joseph Mercy Oakland Hospital, Pontiac",Dissertations and Theses (Ph.D. and Master's),
"Cohn, Danielle",https://hdl.handle.net/2027.42/167375,Project,,,2021-04,en_US,Great Lakes Ice Cover: Enriching Database and Improving Forecast,Dissertations and Theses (Ph.D. and Master's),
"Louria, Bethany",https://hdl.handle.net/2027.42/167363,Project,,,2021-04,en_US,Increasing Resistance and Reducing Vulnerability to Invasive Species at Sleeping Bear Dunes National Lakeshore,Dissertations and Theses (Ph.D. and Master's),
"Bechard, Kevin",https://hdl.handle.net/2027.42/167373,Practicum,,,2021-04,en_US,Greek Paths of Culture: Reimagining Ancient Trails in the Rhodope Mountains,Dissertations and Theses (Ph.D. and Master's),
"Elizondo Pineiro, Maite",https://hdl.handle.net/2027.42/167365,Practicum,,,2021-04,en_US,Stories of the Pandemic: Narratives from Gratiot/7 Mile Residents,Dissertations and Theses (Ph.D. and Master's),
"Chang, Emma",https://hdl.handle.net/2027.42/167734,Thesis,Business and Economics,Ann Arbor,2021-04,en_US,The effect of social network structure on  the spread and existence of burnout in medical residents,"Business, Stephen M. Ross School of - Senior Thesis Written Reports",
"Thomas, Laurie",https://hdl.handle.net/2027.42/167698,Thesis,,,2021-04,,The Tragic Events,Dissertations and Theses (Ph.D. and Master's),
"McDaniel, Julia",https://hdl.handle.net/2027.42/167712,Thesis,,,2021-04,,Serpentine,Dissertations and Theses (Ph.D. and Master's),
"Streng, Conor",https://hdl.handle.net/2027.42/167641,Project,,,2021-04,,Passive Pressure Modulation Mechanism for Improved Locomotion,"Mechanical Engineering, Department of",
"Stokes, Samantha",https://hdl.handle.net/2027.42/167289,Practicum,,,2021-04,en_US,Mnomen: Assessing the Feasability of Anishinaabe-Centered Wild Rice Restoration on University of Michigan Properties,Dissertations and Theses (Ph.D. and Master's),
"Schuler, Jordan",https://hdl.handle.net/2027.42/167899,Thesis,,Ann Arbor,2021-04,,Examining Key Narratives Surrounding Public Opinion on Redistricting Reform: A Case Study of Michigan’s Proposition 2 (2018),Honors Theses (Bachelor's),
"Mayorga, Isabella",https://hdl.handle.net/2027.42/167238,Thesis,,,2021-04,en_US,"Tradeoffs and synergies among ecosystem services, biodiversity conservation, and food security in 2 coffee agroforestry",Dissertations and Theses (Ph.D. and Master's),
"Greenberg, Anna",https://hdl.handle.net/2027.42/168544,Thesis,,,2021-04,en_US,"Monitoring and Leveraging Hydrologic restoration in the Shiawassee Flats Estuary, Year 2",Dissertations and Theses (Ph.D. and Master's),
"Bacha, Michael Joel",https://hdl.handle.net/2027.42/167648,Project,,,2021-04,,Packaging of Planetary Exploration Organic Composition Analyzer for NASA’s Europa Mission,"Mechanical Engineering, Department of",
"Li, Zijun",https://hdl.handle.net/2027.42/167372,Thesis,,,2021-04,en_US,Assessing heat vulnerability of New Orleans using multitemporal remote sensing and demographic data,Dissertations and Theses (Ph.D. and Master's),
"Wee, Jia Chen",https://hdl.handle.net/2027.42/167652,Project,,,2021-04,,Smartphone Based Personalized Balance Training Platform,"Mechanical Engineering, Department of",
"Schneider, Hannah",https://hdl.handle.net/2027.42/167883,Thesis,,Ann Arbor,2021-04,,Ujamaa and the Egalitarian Paradox: The Correlation between Socialism and Contemporary Public Service Disparities Among Villages in Rural Tanzania,Honors Theses (Bachelor's),
"Edinger, Jackie",https://hdl.handle.net/2027.42/167368,Project,,,2021-04,en_US,Assessing and Communicating Climate and Water Ecosystem Services of the City of Ann Arbor Greenbelt Program,Dissertations and Theses (Ph.D. and Master's),
"Honigford, Joel",https://hdl.handle.net/2027.42/167640,Project,,,2021-04,,Automated Jerboa Startling Device,"Mechanical Engineering, Department of",
"Sermchaiwong, Panisa",https://hdl.handle.net/2027.42/167741,Thesis,Business and Economics,Ann Arbor,2021-04,en_US,Just Right: Gaining and Maintaining Brand  Loyalty Through the Lens of K-Pop,"Business, Stephen M. Ross School of - Senior Thesis Written Reports",
"Gupta, Riya",https://hdl.handle.net/2027.42/167742,Thesis,Business and Economics,Ann Arbor,2021-04,en_US,Search Term-Intention Congruency in Brand-Ubiquitous Categories and Private Label  Receptiveness on the Digital Shelf,"Business, Stephen M. Ross School of - Senior Thesis Written Reports",
"O'Brien, Conner",https://hdl.handle.net/2027.42/167364,Practicum,,,2021-04,en_US,The Future of Dana: Achieving Net Zero Emissions and Leading by Example,Dissertations and Theses (Ph.D. and Master's),
"Benyamin, Aditya",https://hdl.handle.net/2027.42/167376,Practicum,,,2021-04,en_US,"Discussion, Data Visualization, and Dialogical Learning Materials for Diverse Audiences Education and Action for The Last Animals Foundation",Dissertations and Theses (Ph.D. and Master's),
"Wang, Meiye",https://hdl.handle.net/2027.42/167344,Thesis,,,2021-04,en_US,Variability of the value of Vehicle-to-grid across vehicle and time in future California grid,Dissertations and Theses (Ph.D. and Master's),
"Dusicska, Emily",https://hdl.handle.net/2027.42/167292,Project,,,2021-04,en_US,Assessing Nutrient Management Strategies to Control Harmful Algal Blooms in Lake Erie,Dissertations and Theses (Ph.D. and Master's),
"Ors, Shannon",https://hdl.handle.net/2027.42/167744,Thesis,Business and Economics,Ann Arbor,2021-04,en_US,"The Power of the Pen, the Press, and the Algorithm:  Evaluating the Framing of Google News Regulatory  Efforts in the European Union and Australia","Business, Stephen M. Ross School of - Senior Thesis Written Reports",
"Kan, Mengqing",https://hdl.handle.net/2027.42/167299,Thesis,,,2021-04,en_US,Dynamic flows and stocks of plastics in the United States and pathways towards zero plastic pollution by 2050,Dissertations and Theses (Ph.D. and Master's),
"Yadav, Aniket",https://hdl.handle.net/2027.42/167294,Practicum,,,2021-04,en_US,"Investigate technical, policy and business approaches to addressing stewardship and circularity for end-of-life for PV system",Dissertations and Theses (Ph.D. and Master's),
"Somers, Madeline",https://hdl.handle.net/2027.42/167154,Thesis,,,2021-04,en_US,Feasibility of Superabsorbent Polymer Recycling in Disposable Absorbent Hygiene Products,Dissertations and Theses (Ph.D. and Master's),
"Ching, Alan",https://hdl.handle.net/2027.42/167302,Project,,,2021-04,en_US,Human-Leopard Conflict and Coexistence in Northern Kenya,Dissertations and Theses (Ph.D. and Master's),
"Fei, Jiani",https://hdl.handle.net/2027.42/167885,Thesis,,Ann Arbor,2021-04,,A Probe into Propagators,Honors Theses (Bachelor's),
"Blair, Shannon",https://hdl.handle.net/2027.42/167195,Project,,,2021-04,en_US,"Greenhouse Gas Inventory and Corporate Climate Strategy for Ocean Spray Cranberries, Inc.",Dissertations and Theses (Ph.D. and Master's),
"Wang, Grace",https://hdl.handle.net/2027.42/167735,Project,Business and Economics,Ann Arbor,2021-04,en_US,China’s Semiconductor Industrial Policy and  Income A Case Study at the Provincial Level,"Business, Stephen M. Ross School of - Senior Thesis Written Reports",
"Van Note, Sean",https://hdl.handle.net/2027.42/167656,Project,,,2021-04,,Compression Device for 3D Spheroids in Microgravity,"Mechanical Engineering, Department of",
"Daniel, Nicholas",https://hdl.handle.net/2027.42/167892,Thesis,,Ann Arbor,2021-04,,Leapfrogging Development: Analyzing the Trends of Urbanization in Sub-Saharan Africa: Westernization Versus the Informal Economy,Honors Theses (Bachelor's),
"Bledsoe, Isabella",https://hdl.handle.net/2027.42/167214,Project,,,2021-04,en_US,Bridging the Implementation Gap: Designing a Course of Action with Michigan Public Advisory Councils,Dissertations and Theses (Ph.D. and Master's),
"Gabriel, Marissa",https://hdl.handle.net/2027.42/167644,Project,,,2021-04,,Squid Speed,"Mechanical Engineering, Department of",
"Liao, Zitong",https://hdl.handle.net/2027.42/167196,Thesis,,,2021-04,en_US,V2G-capable shared autonomous electric vehicles fleet: Economic viability and environmental co-benefits,Dissertations and Theses (Ph.D. and Master's),
"Lee, Seneca",https://hdl.handle.net/2027.42/167346,Practicum,,,2021-04,en_US,Meso and Macrofauna Responses to Biochar in Urban Soils,Dissertations and Theses (Ph.D. and Master's),
"Fysudeen, Fareah",https://hdl.handle.net/2027.42/167884,Thesis,,Ann Arbor,2021-04,,Modernity and the (Im)Possibility of Transcendence: A Cognitive Map for Liberation: From Nietzsche and Modern Binaries to Ghazalian Noetics,Honors Theses (Bachelor's),
"Su, Chenyang",https://hdl.handle.net/2027.42/167259,Thesis,,,2021-04,en_US,"Factors Impacting American Leaf Spot Disease Incidence and Intensity in a Shaded Coffee Farm in Chiapas, Mexico",Dissertations and Theses (Ph.D. and Master's),
"Nelles, Drew",https://hdl.handle.net/2027.42/167696,Thesis,,,2021-04,,Triangulation: Stories,Dissertations and Theses (Ph.D. and Master's),
"Armbruster, Sarah",https://hdl.handle.net/2027.42/167643,Project,,,2021-04,,Shark Attach,"Mechanical Engineering, Department of",
"Martinez, Leandro",https://hdl.handle.net/2027.42/167649,Project,,,2021-04,,Sensor.IO,"Mechanical Engineering, Department of",
"Wamser, Matthew",https://hdl.handle.net/2027.42/167716,Thesis,,,2021-04,,The Little Ice Age,Dissertations and Theses (Ph.D. and Master's),
"Garcia, Helena",https://hdl.handle.net/2027.42/167296,Project,,,2021-04,en_US,Assessing Equity and Environmental Justice in the Great Lakes Restoration Initiative,Dissertations and Theses (Ph.D. and Master's),
"Weisman, Rachael",https://hdl.handle.net/2027.42/167653,Project,,,2021-04,,An at Home Cardiorespiratory Monitor  in Low Income Countries,"Mechanical Engineering, Department of",
"Dierdorf, Joseph",https://hdl.handle.net/2027.42/167381,Project,,,2021-04,en_US,Implementing Natural Infrastructure in the Upper Mississippi River Basin: Lessons from Iowa,Dissertations and Theses (Ph.D. and Master's),
"Dhamankar, Prachiti",https://hdl.handle.net/2027.42/167178,Project,,,2021-04,en_US,"Scope 3 Emissions Inventory and Supplier Engagement for Steelcase, Inc.",Dissertations and Theses (Ph.D. and Master's),
"Marano, Ellary",https://hdl.handle.net/2027.42/167343,Thesis,,,2021-04,en_US,Evidence for the Importance of Invasive Dreissena veligers as a Novel Prey Item for Larval Fish,Dissertations and Theses (Ph.D. and Master's),
"Essa, Elena",https://hdl.handle.net/2027.42/167290,Thesis,,,2021-04,en_US,The Impact of Renewable Energy versus Fossil Fuel Energy on Human Development,Dissertations and Theses (Ph.D. and Master's),
"Appledorn, Michele",https://hdl.handle.net/2027.42/167639,Project,,,2021-04,,Carbon Neutral luxury Dog House,"Mechanical Engineering, Department of",
"Wegryn-Jones, Arynne",https://hdl.handle.net/2027.42/167877,Thesis,,Ann Arbor,2021-04,,The Culture of Composting in U-M Residence Halls,Honors Theses (Bachelor's),
"Li, Jessie",https://hdl.handle.net/2027.42/167737,Thesis,Business and Economics,Ann Arbor,2021-04,en_US,An Ethical Evaluation of Corporate Lobbying Practices:  A Case Study on Facebook Inc’s Lobbying Strategies,"Business, Stephen M. Ross School of - Senior Thesis Written Reports",
"Nee, Michelle",https://hdl.handle.net/2027.42/167740,Thesis,Business and Economics,Ann Arbor,2021-04,en_US,Does Effectiveness Matter? Measuring Consumer Value for Corporate Social  Responsibility,"Business, Stephen M. Ross School of - Senior Thesis Written Reports",
"Shifrin, Jonah",https://hdl.handle.net/2027.42/167638,Project,,,2021-04,,E-Bike Engagement and Accessibility,"Mechanical Engineering, Department of",
"Fields, Tess",https://hdl.handle.net/2027.42/167369,Project,,,2021-04,en_US,Transportation Greenhouse Gas Emissions Baseline for the Ann Arbor 2030 District,Dissertations and Theses (Ph.D. and Master's),
"Chamra, Maya",https://hdl.handle.net/2027.42/167879,Thesis,,Ann Arbor,2021-04,,Sexual Violence on College Campuses: The Effects of State Sexual Violence Laws on University Reporting Rates,Honors Theses (Bachelor's),
"Nagappan, Karthik Valliappan",https://hdl.handle.net/2027.42/167738,Thesis,Business and Economics,Ann Arbor,2021-04,en_US,Assessing the Effect of Racial Bias on Approval  of Health Care Reform Proposals: A Survey of  Attitudes toward Politicians and their Policies,"Business, Stephen M. Ross School of - Senior Thesis Written Reports",
"Pattipati, Marie Aiudi",https://hdl.handle.net/2027.42/169407,Thesis,,Ann Arbor,2021-04,,Narrative Subversion of Acknowledgement and Denial within ex-Nazi Memoirs,Honors Theses (Bachelor's),
"McCord, Stephen",https://hdl.handle.net/2027.42/167009,Technical Report,Engineering,Ann Arbor,2021-03-31,en_US,Multi-Attributional Decision Making in LCA & TEA for CCU: An Introduction to Approaches and a Worked Example,Global CO2 Initiative,
"Garvin, Roger",https://hdl.handle.net/2027.42/167008,Preprint,Health Sciences,Ann Arbor,2021-03-31,en_US,Community Collaboration to Implement a Vaccination Clinic in Rural Areas,COVID-19: Annals of Family Medicine,
"McNally, James",https://hdl.handle.net/2027.42/167004,Conference Paper,Social Sciences,Ann Arbor,2021-03-30,en_US,The Impact of COVID-19 on Older Populations: How We Failed Our Elders and What We Can Learn From These Failures,Inter-university Consortium for Political and Social Research (ICPSR),Peer Reviewed
"Zhou, Feng",https://hdl.handle.net/2027.42/167003,Article,Engineering,Dearborn,2021-03-26,en_US,Using Eye-tracking Data to Predict Situation Awareness in Real Time during Takeover Transitions in Conditionally Automated Driving,"Industrial and Manufacturing Systems Engineering (IMSE, UM-Dearborn)",Peer Reviewed
"Jing, Shijie",https://hdl.handle.net/2027.42/167605,Article,Social Sciences,Ann Arbor,2021-03-26,en_US,Mindfulness-based interventions for breast cancer patients in China across outcome domains: a systematic review and meta-analysis of the Chinese literature,"Social Work, School of (SSW)",Peer Reviewed
"Kabo, Felichism",https://hdl.handle.net/2027.42/166998,Conference Paper,Social Sciences,Ann Arbor,2021-03-25,en_US,"Associations between Library Usage and Undergraduate Student GPA, 2016-2019",Library (University of Michigan Library),
"Etz, Rebecca",https://hdl.handle.net/2027.42/167001,Preprint,Health Sciences,Ann Arbor,2021-03-25,en_US,"Quick Covid-19 Primary Care Survey, Series 27",COVID-19: Annals of Family Medicine,
"Stockton, Ronald R.",https://hdl.handle.net/2027.42/166999,Other,Political Science,Dearborn,2021-03-25,en_US,Bernard Klein:  RIP,"Social Sciences: Political Science, Department of (UM-Dearborn)",
"McNally, James",https://hdl.handle.net/2027.42/167000,Presentation,Social Sciences,Ann Arbor,2021-03-25,en_US,NACDA and NACDA-OAR: Secondary Data Resources and an Open Aging Repository,Inter-university Consortium for Political and Social Research (ICPSR),
"Goodyear-Smith, Felicity",https://hdl.handle.net/2027.42/166593,Other,Health Sciences,Ann Arbor,2021-03-22,en_US,"Quick COVID-19 New Zealand Primary Care Survey, series 9-11",COVID-19: Annals of Family Medicine,
"Crowley, Tadhg",https://hdl.handle.net/2027.42/166586,Preprint,Health Sciences,Ann Arbor,2021-03-22,en_US,"A Reflection on our Drive Through Flu Vaccine Clinic ""Vires Rebus Adversis""",COVID-19: Annals of Family Medicine,
"Douglas, Kirsty",https://hdl.handle.net/2027.42/166589,Other,Health Sciences,Ann Arbor,2021-03-22,en_US,"Quick COVID Clinician Survey Summary (Australia), series 9-13",COVID-19: Annals of Family Medicine,
"Douglas, Kirsty",https://hdl.handle.net/2027.42/166587,Other,Health Sciences,Ann Arbor,2021-03-22,en_US,"Quick COVID Clinician Survey Summary (Australia), series 1-4.",COVID-19: Annals of Family Medicine,
"Zhang, Anao",https://hdl.handle.net/2027.42/167606,Article,Social Sciences,Ann Arbor,2021-03-22,en_US,Mindfulness-Based Intervention for Chinese Breast Cancer Patients: A Systematic Review and Meta-Analysis,"Social Work, School of (SSW)",Peer Reviewed
"Jang, Sunho",https://hdl.handle.net/2027.42/166595,Conference Paper,Engineering,Ann Arbor,2021-03-22,en_US,Large-Scale Invariant Sets for Safe Coordination of Thermostatic Loads,"Electrical Engineering and Computer Science, Department of (EECS)",Peer Reviewed
"Goodyear-Smith, Felicity",https://hdl.handle.net/2027.42/166590,Other,Health Sciences,Ann Arbor,2021-03-22,en_US,"Quick COVID-19 New Zealand Primary Care Survey, series 1-4",COVID-19: Annals of Family Medicine,
"Douglas, Kirsty",https://hdl.handle.net/2027.42/166588,Other,Health Sciences,Ann Arbor,2021-03-22,en_US,"Quick COVID Clinician Survey Summary (Australia), series 5-8",COVID-19: Annals of Family Medicine,
"Goodyear-Smith, Felicity",https://hdl.handle.net/2027.42/166592,Other,Health Sciences,Ann Arbor,2021-03-22,en_US,"Quick COVID-19 New Zealand Primary Care Survey, series 5-8",COVID-19: Annals of Family Medicine,
"Seco, Jose R.",https://hdl.handle.net/2027.42/166596,Poster,Health Sciences,Ann Arbor,2021-03-22,en_US,Clinical Usefulness Of Sars-Cov-2 Rapid Antigen Tests In Adults During High Prevalence Community Outbreaks,COVID-19: Annals of Family Medicine,
"Zhang, Hui",https://hdl.handle.net/2027.42/167607,Article,Social Sciences,Ann Arbor,2021-03-18,en_US,A Brief Online Mindfulness-Based Group Intervention for Psychological Distress Among Chinese Residents During COVID-19: a Pilot Randomized Controlled Trial,"Social Work, School of (SSW)",Peer Reviewed
"JUNHAN, KIM",https://hdl.handle.net/2027.42/166481,Conference Paper,Social Science,Ann Arbor,2021-03-16,en_US,Trustworthy Conversational Agent Design for African Americans with Chronic Conditions during COVID-19,"Information, School of (SI)",Peer Reviewed
"Roberts, Leslee",https://hdl.handle.net/2027.42/166482,Preprint,Health Sciences,Ann Arbor,2021-03-16,en_US,Integrating General Practice into the Australian COVID-19 response: A description of the GP Respiratory Clinic program in Australia,COVID-19: Annals of Family Medicine,
"Rutledge, Kwesi",https://hdl.handle.net/2027.42/166479,Conference Paper,Engineering,Ann Arbor,2021-03-15,en_US,Compositional Safety Rules for Inter-Triggering Hybrid Automata,"Electrical Engineering and Computer Science, Department of (EECS)",Peer Reviewed
"Lipman, Paula Darby",https://hdl.handle.net/2027.42/166477,Archival Material,Health Sciences,Ann Arbor,2021-03-13,en_US,"Understanding Paramedic, Trial Network, and Patient’s Family Experiences in Emergency Research Clinical Trials",Emergency Medicine,
"Silbergleit, Robert",https://hdl.handle.net/2027.42/166478,Archival Material,Health Sciences,Ann Arbor,2021-03-13,en_US,"Model Operational Procedures for the Implementation and Review of NIH Sponsored Multicenter Clinical Trials with Exception from Informed Consent (EFIC) for Emergency Research, Version 1 - January 2021",Emergency Medicine,
"Ramos, Marlon D.",https://hdl.handle.net/2027.42/167720,Article,Science,Ann Arbor,2021-03-05,en_US,Assessing Margin-wide Rupture Behavior along hte Cascadia Megathrust using 3-D Dynamic Rupture Simulations,"Earth and Environmental Sciences, Department of",
"Zhang, Anao",https://hdl.handle.net/2027.42/167608,Article,Social Sciences,Ann Arbor,2021-03-03,en_US,"Psychosocial, behavioral, and supportive interventions for pediatric, adolescent, and young adult cancer survivors: a systematic review and meta-analysis","Social Work, School of (SSW)",Peer Reviewed
"Malani, Preeti",https://hdl.handle.net/2027.42/166322,Other,,Ann Arbor,2021-03-02,en_US,National Poll on Healthy Aging: Hearing Loss Among Older Adults - Screening and Testing,Institute for Healthcare Policy & Innovation (IHPI),
"Etz, Rebecca",https://hdl.handle.net/2027.42/166450,Preprint,Health Sciences,Ann Arbor,2021-03-02,en_US,"Quick Covid-19 Primary Care Survey, Series 26",COVID-19: Annals of Family Medicine,
"Bian, Zhangxing",https://hdl.handle.net/2027.42/166324,Working Paper,Health Sciences,Ann Arbor,2021-03-02,en_US,Validation of a Robust Method for Quantification of Three-Dimensional Growth of the Thoracic Aorta Using Deformable Image Registration,"Radiology, Department of",
"Burris, Nicholas",https://hdl.handle.net/2027.42/166323,Working Paper,Health Sciences,Ann Arbor,2021-03-02,en_US,Vascular Deformation Mapping for CT Surveillance of Thoracic Aortic Aneurysm Growth,"Radiology, Department of",
"Gagliardi, Kristin",https://hdl.handle.net/2027.42/166320,Preprint,Health Sciences,Ann Arbor,2021-03-01,en_US,Counterproductive Messaging About COVID-19 Safety Measures in Cancer Screening Outreach: Results of a Pragmatic Randomized Trial,COVID-19: Annals of Family Medicine,
"Haimson, Oliver L.",https://hdl.handle.net/2027.42/168410,Book chapter,Social Science,Ann Arbor,2021-03,en_US,Online Communities,"Information, School of (SI)",
"Lakshmanan, Sridhar",https://hdl.handle.net/2027.42/166585,Technical Report,Engineering,Ann Arbor,2021-03,,Reliable V2V Communication Networks: Applications in Fuel-Efficient Platooning,"Electrical and Computer Engineering, Department of (UM-Dearborn)",
